{
  "$schema": "http://json-schema.org/draft-07/schema#",
  "$id": "https://github.com/luxdsan/neotel-industry-trends/schema.json",
  "title": "Neotel industry trend brief",
  "description": "Structured output of one /trends/run (daily) or /trends/weekly run. Consumed read-only by the CN-server result sync tool.",
  "type": "object",
  "additionalProperties": false,
  "required": [
    "runId",
    "generatedAt",
    "status",
    "window",
    "items",
    "report"
  ],
  "properties": {
    "runId": {
      "type": "string",
      "minLength": 1,
      "maxLength": 128
    },
    "generatedAt": {
      "type": "string",
      "pattern": "^\\d{4}-\\d{2}-\\d{2}T\\d{2}:\\d{2}:\\d{2}(\\.\\d+)?(Z|[+-]\\d{2}:\\d{2})$"
    },
    "status": {
      "type": "string",
      "enum": [
        "completed",
        "failed",
        "empty"
      ]
    },
    "window": {
      "type": "object",
      "additionalProperties": false,
      "required": [
        "from",
        "to"
      ],
      "properties": {
        "from": {
          "type": "string",
          "minLength": 10
        },
        "to": {
          "type": "string",
          "minLength": 10
        }
      }
    },
    "items": {
      "type": "array",
      "maxItems": 100,
      "items": {
        "type": "object",
        "additionalProperties": false,
        "required": [
          "id",
          "title",
          "url",
          "source",
          "eventTime",
          "fetchedAt",
          "summaryZh",
          "topic",
          "score",
          "seenCount"
        ],
        "properties": {
          "id": {
            "type": "string",
            "pattern": "^[0-9a-f]{40}$",
            "description": "sha1(canonical_url)"
          },
          "title": {
            "type": "string",
            "minLength": 1,
            "maxLength": 300
          },
          "url": {
            "type": "string",
            "pattern": "^https?://"
          },
          "source": {
            "type": "string",
            "minLength": 1,
            "maxLength": 120
          },
          "eventTime": {
            "type": "string",
            "pattern": "^\\d{4}-\\d{2}-\\d{2}"
          },
          "fetchedAt": {
            "type": "string",
            "minLength": 10
          },
          "summaryZh": {
            "type": "string",
            "maxLength": 80,
            "description": "≤80 字事实摘要（code points）"
          },
          "topic": {
            "type": "string",
            "enum": [
              "设备",
              "材料",
              "供应链",
              "政策标准",
              "展会",
              "厂商动态"
            ]
          },
          "score": {
            "type": "integer",
            "minimum": 0,
            "maximum": 100
          },
          "seenCount": {
            "type": "integer",
            "minimum": 1
          }
        }
      }
    },
    "report": {
      "type": "object",
      "additionalProperties": false,
      "required": [
        "titleZh",
        "highlights",
        "topics",
        "neotelNote",
        "markdown"
      ],
      "properties": {
        "titleZh": {
          "type": "string",
          "minLength": 1,
          "maxLength": 120
        },
        "highlights": {
          "type": "array",
          "maxItems": 8,
          "items": {
            "type": "object",
            "additionalProperties": false,
            "required": [
              "text",
              "itemIds"
            ],
            "properties": {
              "text": {
                "type": "string",
                "minLength": 1,
                "maxLength": 160
              },
              "itemIds": {
                "type": "array",
                "minItems": 1,
                "items": {
                  "type": "string",
                  "pattern": "^[0-9a-f]{40}$"
                }
              }
            }
          }
        },
        "topics": {
          "type": "array",
          "items": {
            "type": "object",
            "additionalProperties": false,
            "required": [
              "name",
              "count"
            ],
            "properties": {
              "name": {
                "type": "string",
                "enum": [
                  "设备",
                  "材料",
                  "供应链",
                  "政策标准",
                  "展会",
                  "厂商动态"
                ]
              },
              "count": {
                "type": "integer",
                "minimum": 1
              }
            }
          }
        },
        "neotelNote": {
          "type": "string",
          "maxLength": 300,
          "description": "挚锦解读；无物料管理关联时为空字符串"
        },
        "markdown": {
          "type": "string"
        }
      }
    }
  }
}
